{
    "$schema": "http://json-schema.org/schema#",
    "type": "object",
    "properties": {
        "created": {
            "type": "string"
        },
        "id": {
            "type": "string"
        },
        "identity_class": {
            "type": "string"
        },
        "modified": {
            "type": "string"
        },
        "name": {
            "type": "string"
        },
        "object_marking_refs": {
            "type": "array",
            "items": {
                "type": "string"
            }
        },
        "spec_version": {
            "type": "string"
        },
        "type": {
            "type": "string"
        }
    },
    "required": [
        "created",
        "id",
        "identity_class",
        "modified",
        "name",
        "object_marking_refs",
        "spec_version",
        "type"
    ]
}