{
    "created": "2023-01-30T20:40:28.791901Z",
    "id": "identity--e50ab59c-5c4f-4d40-bf6a-d58418d89bcd",
    "identity_class": "organization",
    "modified": "2023-01-30T20:40:28.791901Z",
    "name": "The MITRE Corporation",
    "object_marking_refs": [
        "marking-definition--17d82bb2-eeeb-4898-bda5-3ddbcd2b799d"
    ],
    "spec_version": "2.1",
    "type": "identity"
}
